{
  "apiVersion": "edgeai.stream-ack/v1",
  "generation": 1,
  "producer": {
    "deviceId": "33333333-3333-4333-8333-333333333333",
    "epoch": 1,
    "kind": "DEVICE_SESSION",
    "sessionId": "22222222-2222-4222-8222-222222222222"
  },
  "routeId": "11111111-1111-4111-8111-111111111111",
  "sequence": 1
}
